{
  "schema_version": "1.0.0",
  "plan_hash": "99937c29ae83d6548c732c5890d240e3e12aaa02b45b9555d746421a754d2b24",
  "content": {
    "plan_id": "88888888-8888-4888-8888-888888888881",
    "created_at": "2026-07-12T23:00:00Z",
    "dataset_purpose": "CALIBRATION_3D",
    "parameter_set_version": "of-alpha-v1",
    "price_action_schema_hash": "d2305132fb4bfc4752bc1f5b889ee5ecb4344e0dbdafb1b744a5612e3577df63",
    "price_action_config_hash": "69f9f2c78c7079b1eefa5a20b88aafdf9d7bda2b50ff4b800d4e4629dceaa9d5",
    "parameters": {
      "of_window_short_ms": { "type": "integer", "minimum": 100, "maximum": 1000, "step": 100 },
      "of_window_medium_ms": { "type": "integer", "minimum": 1000, "maximum": 5000, "step": 500 },
      "of_window_long_ms": { "type": "integer", "minimum": 5000, "maximum": 30000, "step": 1000 },
      "book_depth_levels": { "type": "integer", "minimum": 5, "maximum": 50, "step": 5 },
      "book_imbalance_threshold": { "type": "decimal", "minimum": "0.05", "maximum": "0.80", "step": "0.05" },
      "microprice_confirmation_bps": { "type": "decimal", "minimum": "0.10", "maximum": "5.00", "step": "0.10" },
      "trade_imbalance_threshold": { "type": "decimal", "minimum": "0.05", "maximum": "0.90", "step": "0.05" },
      "cvd_slope_threshold": { "type": "decimal", "minimum": "0.00", "maximum": "5.00", "step": "0.10" },
      "aggressive_notional_quantile": { "type": "decimal", "minimum": "0.50", "maximum": "0.99", "step": "0.01" },
      "sweep_intensity_threshold": { "type": "decimal", "minimum": "0.10", "maximum": "3.00", "step": "0.10" },
      "swept_levels_min": { "type": "integer", "minimum": 1, "maximum": 10, "step": 1 },
      "continuation_hold_ms": { "type": "integer", "minimum": 100, "maximum": 5000, "step": 100 },
      "maximum_sweep_retrace_ratio": { "type": "decimal", "minimum": "0.10", "maximum": "1.00", "step": "0.05" },
      "absorption_score_threshold": { "type": "decimal", "minimum": "0.10", "maximum": "10.00", "step": "0.10" },
      "absorption_max_move_bps": { "type": "decimal", "minimum": "0.10", "maximum": "10.00", "step": "0.10" },
      "refill_ratio_threshold": { "type": "decimal", "minimum": "0.10", "maximum": "3.00", "step": "0.10" },
      "refill_window_ms": { "type": "integer", "minimum": 100, "maximum": 5000, "step": 100 },
      "reversal_trade_imbalance_threshold": { "type": "decimal", "minimum": "0.05", "maximum": "0.90", "step": "0.05" },
      "minimum_confirmation_components": { "type": "integer", "minimum": 2, "maximum": 6, "step": 1 },
      "signal_cooldown_ms": { "type": "integer", "minimum": 0, "maximum": 30000, "step": 500 }
    },
    "parameter_scope": {
      "of_window_short_ms": "GLOBAL",
      "of_window_medium_ms": "GLOBAL",
      "of_window_long_ms": "GLOBAL",
      "book_depth_levels": "GLOBAL",
      "book_imbalance_threshold": "BY_LIQUIDITY_BUCKET",
      "microprice_confirmation_bps": "BY_LIQUIDITY_BUCKET",
      "trade_imbalance_threshold": "BY_LIQUIDITY_BUCKET",
      "cvd_slope_threshold": "BY_LIQUIDITY_BUCKET",
      "aggressive_notional_quantile": "BY_LIQUIDITY_BUCKET",
      "sweep_intensity_threshold": "BY_LIQUIDITY_BUCKET",
      "swept_levels_min": "BY_LIQUIDITY_BUCKET",
      "continuation_hold_ms": "GLOBAL",
      "maximum_sweep_retrace_ratio": "BY_LIQUIDITY_BUCKET",
      "absorption_score_threshold": "BY_LIQUIDITY_BUCKET",
      "absorption_max_move_bps": "BY_LIQUIDITY_BUCKET",
      "refill_ratio_threshold": "BY_LIQUIDITY_BUCKET",
      "refill_window_ms": "GLOBAL",
      "reversal_trade_imbalance_threshold": "BY_LIQUIDITY_BUCKET",
      "minimum_confirmation_components": "GLOBAL",
      "signal_cooldown_ms": "GLOBAL"
    },
    "feature_window_mapping": {
      "book_imbalance": "LATEST_VALID_BOOK",
      "microprice": "LATEST_VALID_BOOK",
      "trade_imbalance_continuation": "SHORT",
      "trade_imbalance_reversal": "SHORT",
      "cvd_slope": "MEDIUM",
      "aggressive_notional": "SHORT",
      "sweep_intensity": "SHORT",
      "absorption_score": "MEDIUM",
      "sweep_retrace": "CONTINUATION_HOLD",
      "refill": "REFILL_WINDOW"
    },
    "non_optimized_semantics": {
      "numeric_type": "DECIMAL",
      "decimal_context_precision": 34,
      "rounding": "ROUND_HALF_EVEN",
      "intermediate_quantization": "NONE",
      "output_decimal_places": 18,
      "comparison_boundary": "INCLUSIVE",
      "event_window_interval": "LEFT_OPEN_RIGHT_CLOSED_AS_OF_INCLUSIVE",
      "market_event_merge_rule": "PARTITION_SEQUENCE_THEN_250MS_WATERMARK_KWAY_HEAD_ORDER_V1",
      "channel_priority": ["BOOK_SNAPSHOT", "BOOK_DIFF", "AGG_TRADE", "MARK_PRICE", "KLINE", "INTERNAL_TIMER"],
      "nonpositive_denominator": "INVALID_NO_TRADE",
      "absorption_move_floor": "MAX_ONE_TICK_BPS_AND_FIXED_FLOOR",
      "fixed_move_floor_bps": "0.10",
      "sweep_episode_max_gap_ms": 100,
      "sweep_episode_direction_rule": "SAME_AGGRESSOR_DIRECTION_UNTIL_OPPOSITE_OR_GAP",
      "pre_event_book_rule": "LATEST_VALID_CAUSALLY_AVAILABLE_BOOK_BEFORE_FIRST_TRADE",
      "swept_levels_rule": "CONTIGUOUS_FROM_BEST_FULLY_DEPLETED_PRE_EVENT_LEVELS",
      "refill_price_set_rule": "EXACT_FULLY_DEPLETED_SWEPT_LEVELS",
      "bucket_tie_break": "SYMBOL_UTF8_ASC",
      "candidate_selection_rule": "DOCS03_SECTION_11_2_V1_DECIMAL_LEXICOGRAPHIC"
    },
    "liquidity_buckets": {
      "method": "PREREGISTERED_CROSS_SECTIONAL_QUANTILES",
      "bucket_count": 3,
      "observation_unit": "ELIGIBLE_SYMBOL_AT_UNIVERSE_15M_SNAPSHOT",
      "assignment_inputs": ["trade_notional_15m", "two_sided_depth_10bps", "median_spread_bps"],
      "component_transforms": {
        "trade_notional_15m": "LOG1P_ASCENDING",
        "two_sided_depth_10bps": "LOG1P_ASCENDING",
        "median_spread_bps": "NEGATE_ASCENDING"
      },
      "component_percentile": "ORDINAL_RANK_MINUS_1_OVER_N_MINUS_1_SYMBOL_UTF8_TIE_BREAK_N1_HALF",
      "composite_weights": {
        "trade_notional_15m": "0.333333333333333333",
        "two_sided_depth_10bps": "0.333333333333333333",
        "median_spread_bps": "0.333333333333333334"
      },
      "cross_section_assignment": "SORT_COMPOSITE_ASC_SYMBOL_ASC_THEN_BUCKET_FLOOR_3I_OVER_N",
      "minimum_cross_section_symbols": 15,
      "fit_on_training_only": true,
      "minimum_symbol_hours_per_bucket": 24,
      "persist_bucket_in_feature": true
    },
    "objective": {
      "primary": "NET_EXPECTANCY_AFTER_ALL_COSTS",
      "secondary": ["PROFIT_FACTOR", "MAX_DRAWDOWN", "PARAMETER_STABILITY", "SYMBOL_CONCENTRATION"],
      "minimum_calibration_trades": 30,
      "maximum_drawdown_pct": "5.00",
      "reject_if_single_symbol_dominates": true,
      "no_profit_claim": true
    },
    "cost_model": {
      "cost_model_artifact_ref": "contracts/examples/cost-model.json",
      "cost_model_schema_hash": "c66bdb51c464e36e00cde41abb8800aecf767f54402061703859adc735d2c950",
      "cost_model_hash": "8dcf8b3152925b6b96e79771b92f7687219010ae4c8d6533ce76c497ba33a864",
      "execution_model_artifact_ref": "contracts/examples/execution-model.json",
      "execution_model_schema_hash": "9b6d489003e57322133fdaec57486d5973aae4b4021f2d1db8ee739a398fedba",
      "execution_model_hash": "d581fe402814d4ec34fc992e5a7628681081a64484924b83c73664ab09815451",
      "edge_decision_schema_hash": "2a4695bb93cc8ab1e0182b07072185a845421f523d7efab1f95675c7a7185230",
      "gross_edge_method": "SHRUNK_MARKOUT_CELL_MEAN_V1",
      "maker_fee": true,
      "taker_fee": true,
      "slippage": true,
      "adverse_selection": true,
      "funding": true,
      "failure_and_cancel": true,
      "latency": true,
      "partial_fill": true,
      "maker_to_taker": true,
      "stress_multiplier": "1.50"
    },
    "search": {
      "algorithm": "SEEDED_TPE",
      "seed": 20260713,
      "maximum_trials": 2000,
      "optimizer_implementation_id": "content-addressed-seeded-tpe-v1",
      "optimizer_code_commit": "abababababababababababababababababababab",
      "optimizer_image_digest": "sha256:cdcdcdcdcdcdcdcdcdcdcdcdcdcdcdcdcdcdcdcdcdcdcdcdcdcdcdcdcdcdcdcd",
      "optimizer_dependency_lock_hash": "dededededededededededededededededededededededededededededededede",
      "startup_trials": 64,
      "trial_concurrency": 1,
      "candidate_evaluator_version": "candidate-evaluator-v1",
      "candidate_evaluator_hash": "efefefefefefefefefefefefefefefefefefefefefefefefefefefefefefefef",
      "deterministic_replay_required": true,
      "all_declared_parameters_must_be_searched": true
    },
    "stopping": {
      "stop_on_trial_budget": true,
      "stop_on_wall_clock_seconds": 86400,
      "allow_manual_early_stop_after_results": false,
      "retain_all_trials": true
    },
    "forbidden_changes": {
      "price_action": true,
      "risk_limits": true,
      "universe_rules": true,
      "data_quality_rules": true,
      "pa_of_conflict_veto": true,
      "execution_safety": true,
      "future_or_champion_oos_access": true,
      "delete_losing_trades": true
    },
    "output_label": "UNVALIDATED_HIGH_OVERFIT_RISK"
  },
  "signature": {
    "algorithm": "Ed25519",
    "key_id": "research-plan-key-2026q3",
    "signed_at": "2026-07-12T23:05:00Z",
    "signature_ref": "signatures/of-calibration-search-plan.sig"
  }
}
